Code,NAME,DESCRIPTION,
RMS:4B1,Light Metal Frame,"Light Metal Frame : Buildings that are constructed of light steel framing. These are typically long narrow one story buildings, having no interior columns, that are pre-engineered and pre-fabricated and are assembled on, and attached to, a previously constructed concrete slab/foundation. The framing consists of steel moment-resisting frames in the transverse (short) building direction, with diagonal tie rods in the longitudinal (long) building direction. The exterior enclosure for this type of building is typically either corrugated metal or asbestos sheeting that is attached to the vertical light steel framing. The roof is typically either corrugated metal or fiberglass, which are light in weight. Gravity loads are carried by the columns, and lateral earthquake forces are resisted by rigid moment-resisting frame action in the transverse direction and by the diagonal tie-rods in the longitudinal direction. This type of construction is common worldwide.",
RMS:5,Manufactured/Mobile Home,Manufactured/Mobile Home,
RMS:5A,Manufactured/ Mobile Home without Tie- Downs,"Manufactured/ Mobile Home without Tie- Downs : Buildings that are manufactured (completely assembled in a plant), and moved to the desired site. Once sited, utilities are connected and the building is ready for use. In the mid 1900s, most mobile homes came with wheels, and the wheels were removed when the home was permanently situated. Today most of these buildings come without wheels, and the home is hauled to the desired site on a flatbed truck. These are commonly referred to as Manufactured buildings. Mobile homes (or Manufactured homes) are very light and if they are not tied down, they are vulnerable to both earthquake and windstorm lateral forces.",
RMS:5B,Manufactured/ Mobile Home with Tie- Downs,Manufactured/ Mobile Home with Tie- Downs : Buildings having the same basic characteristics as Construction Class 5A except that the buildings are anchored to the ground. The tie-downs make these buildings earthquake and windstorm resistant.,
RMS:6,Conventional Bridges (<500 ft spans) with Multiple Simple Spans,"Conventional Bridges (<500 ft spans) with Multiple Simple Spans : Bridges constructed of concrete, steel, or timber having simple spans, that are each less than 500 ft in length.",
RMS:7,Conventional Bridges (<500 ft spans) with,"Conventional Bridges (<500 ft spans) with : Bridges constructed of concrete, steel, or timber having continuous spans that are each less than 500 ft in length.",
FIRE:1,Frame," Frame : Buildings having wood exterior walls or other combustible
materials including construction where combustible
materials are combined with other materials such as brick
veneer, stone veneer, iron cladding, or stucco on wood.",
FIRE:2,Joisted Masonry," Joisted Masonry : Buildings having masonry exterior walls, such as stone,
adobe, brick, clay tile, concrete block, or concrete, with
combustible joisted wood floors and roof.",
FIRE:3,Non-Combustible,"Non-Combustible : Buildings having walls and floors constructed of, and
supported by non-combustible materials such as metal,
concrete, asbestos, gypsum, or fire-proofed steel.",
FIRE:4,Masonry Non-Combustible,"Masonry Non-Combustible : Buildings having exterior walls constructed of unit masonry,
such as stone, adobe, brick, clay tile, or concrete block, with
floors and roof of metal or other non-combustible material.",
FIRE:5,Modified Fire Resistive,"Modified Fire Resistive Buildings having exterior walls, floors, and roof constructed
of masonry or other fire-resistive material with a fire
resistance rating of one hour or more, but less than two
hours.",
FIRE:6,Fire Resistive,"Fire Resistive : Buildings having exterior walls, floors, and roof constructed
of masonry or other fire-resistive material with a fire
resistance rating of not less than two hours.",
FIRE:7,Heavy Timber Joisted Masonry,"Heavy Timber Joisted Masonry : Joisted Masonry constructed buildings where the following
additional conditions exist: where the entire roof has a minimum thickness of 2 inches with roof supported by
timber having a minimum dimension of 6 inches; or where
the entire roof assembly is documented to have a UL wind
uplift classification of 90 or equivalent.",
FIRE:8,Superior Non-Combustible,"Superior Non-Combustible : Non-combustible constructed buildings where the following
additional conditions exist: where the entire roof is
constructed of 2 inches of masonry on steel supports; or
where the entire roof is constructed of 22 gauge metal (or
heavier) on steel supports; or where the entire roof
assembly is documented to have a wind uplift classification
of 90 or equivalent.",
FIRE:9,Superior Masonry Non-Combustible,"Superior Masonry Non-Combustible : Masonry non-combustible constructed buildings where the
following additional conditions exist: where the entire roof is
constructed of 2 inches of masonry on steel supports; or
where the entire roof is constructed of 22 gauge metal (or
heavier) on steel supports; or where the entire roof
assembly is documented to have wind uplift classification of
90 or equivalent.",
